{
  "topicId": "gi-liver-approach",
  "category": "gi",
  "flashcards": [
    {
      "id": "liverapp-fc-1",
      "front": "وزن طبیعی کبد بزرگسالان چقدر است و چند درصد وزن بدن (بدون توده چربی) را تشکیل می‌دهد؟",
      "back": "حدود ۱ تا ۱.۵ کیلوگرم؛ معادل ۱.۵ تا ۲.۵ درصد وزن بدن بدون توده چربی."
    },
    {
      "id": "liverapp-fc-2",
      "front": "کبد با چه ساختارهایی در محل خود (ناحیه RUQ، چسبیده به دیافراگم) ثابت نگه داشته می‌شود؟",
      "back": "رباط فالسیفورم، رباط‌های کرونری، عروق خونی، و اندام‌های پری‌هپاتیک و فوقانی گوارشی."
    },
    {
      "id": "liverapp-fc-3",
      "front": "چند درصد از جریان خون کبد از شریان کبدی (غنی از اکسیژن) و چند درصد از ورید پورت (غنی از مواد مغذی) تأمین می‌شود؟",
      "back": "۲۰ درصد از شریان کبدی و ۸۰ درصد از ورید پورت؛ ورید پورت خون غنی از مواد مغذی را از معده، روده کوچک، پانکراس و طحال می‌آورد."
    },
    {
      "id": "liverapp-fc-4",
      "front": "کدام نوع سلول حدود دو سوم توده سلولی کبد را تشکیل می‌دهد و چهار نقش اصلی آن کدام است؟",
      "back": "هپاتوسیت‌ها؛ سنتز پروتئین‌های پلاسما (آلبومین، پروتئین‌های حامل، فاکتورهای انعقادی، هورمون‌های رشد)، تولید و ترشح صفرا، تنظیم متابولیسم مواد مغذی، و متابولیسم/کونژوگه‌کردن ترکیبات چربی‌دوست برای دفع از طریق صفرا یا ادرار."
    },
    {
      "id": "liverapp-fc-5",
      "front": "چهار نوع سلول غیرهپاتوسیتی کبد را نام ببرید.",
      "back": "سلول‌های کوپفر (بخشی از سیستم رتیکولواندوتلیال)، سلول‌های ستاره‌ای یا ایتو (ذخیره‌کننده چربی)، سلول‌های اندوتلیال عروقی و مجاری صفراوی، و سلول‌های بافت پشتیبان."
    },
    {
      "id": "liverapp-fc-6",
      "front": "در ساختار آسینار عملکردی کبد، خون سینوزوییدی از کدام زون به کدام زون جریان می‌یابد و جهت جریان صفرا چگونه است؟",
      "back": "خون از زون ۱ (پری‌پورتال) به زون ۲ و سپس زون ۳ (پری‌سانترال/ونیول‌های انتهایی کبدی) جریان می‌یابد؛ صفرا در جهت مخالف، یعنی از زون ۳ به سمت زون ۱، حرکت می‌کند."
    },
    {
      "id": "liverapp-fc-7",
      "front": "فضای Disse بین چه ساختارهایی قرار دارد و چه نقشی در تبادل بین خون و هپاتوسیت دارد؟",
      "back": "بین اندوتلیوم سینوزوییدی و هپاتوسیت؛ روزنه‌های اندوتلیوم اجازه عبور آزاد پلاسما را می‌دهند تا پلاسما به‌طور مستقیم با هپاتوسیت در فضای Disse تماس یابد، جایی که سطح بالایی از فعالیت‌های اندوسیتوزی و پینوسیتوزی هپاتوسیت رخ می‌دهد."
    },
    {
      "id": "liverapp-fc-8",
      "front": "سه الگوی شایع آزمایشگاهی بیماری‌های کبدی کدام‌اند؟",
      "back": "هپاتوسلولار (غلبه افزایش آمینوترانسفرازها/ALT و AST)، کلستاتیک (غلبه افزایش آلکالین فسفاتاز)، و میکس (ترکیبی)."
    },
    {
      "id": "liverapp-fc-9",
      "front": "علت شدید درد شکمی هنگام انسداد صفراوی مثل آبسه کبدی یا سندرم ونواکلوسیو چیست؟",
      "back": "کشیدگی سریع و شدید کپسول گلیسون در اثر تورم حاد کبد (مثل آبسه، سندرم ونواکلوسیو سینوزوییدی، یا به‌ندرت هپاتیت حاد).",
      "tags": [
        "درد"
      ]
    },
    {
      "id": "liverapp-fc-10",
      "front": "شایع‌ترین و کم‌اختصاصی‌ترین علامت بیماری‌های کبدی کدام است و چه ویژگی زمانی دارد؟",
      "back": "خستگی؛ معمولاً پس از فعالیت/ورزش بروز می‌کند و با استراحت کافی هم برطرف نمی‌شود، و برخلاف خستگی طبیعی روزهای بعد از صبح بهتر نمی‌شود."
    },
    {
      "id": "liverapp-fc-11",
      "front": "تهوع در بیماری‌های کبدی با چه علامت دیگری همراه است و چه چیزی می‌تواند آن را تشدید کند؟",
      "back": "معمولاً با خستگی همراه است و مصرف غذاهای چرب می‌تواند تهوع را تحریک کند؛ گاهی استفراغ نیز دیده می‌شود."
    },
    {
      "id": "liverapp-fc-12",
      "front": "بی‌اشتهایی همراه با کاهش وزن در بیماری حاد یا مزمن کبدی شایع‌تر است؟",
      "back": "در بیماری‌های حاد کبدی شایع است؛ در بیماری مزمن کمتر رخ می‌دهد مگر سیروز پیشرفته وجود داشته باشد."
    },
    {
      "id": "liverapp-fc-13",
      "front": "اسهال در بیماری کبدی نادر است؛ در چه شرایطی دیده می‌شود و مکانیسم آن چیست؟",
      "back": "در موارد زردی شدید دیده می‌شود؛ ناشی از کاهش ورود اسیدهای صفراوی به روده است که می‌تواند به استئاتوره منجر شود."
    },
    {
      "id": "liverapp-fc-14",
      "front": "منشأ درد RUQ (درد کبدی) در بیماری‌های کبدی چیست و با چه یافته معاینه‌ای همراه است؟",
      "back": "کشیدگی یا تحریک کپسول گلیسون که پایانه‌های عصبی زیادی دارد؛ معمولاً با تندرنس کبدی همراه است."
    },
    {
      "id": "liverapp-fc-15",
      "front": "خارش در بیماری‌های حاد کبدی از چه ناشی می‌شود و در کدام بیماری‌های مزمن کلستاتیک شایع‌تر و شدیدتر است؟",
      "back": "ناشی از انسداد صفراوی و افزایش سطح صفراوی در خون است؛ در PBC و PSC (کلستاتیک‌های مزمن) زودتر بروز می‌کند و گاه از خارش هپاتیت حاد شدیدتر است."
    },
    {
      "id": "liverapp-fc-16",
      "front": "زردی بدون تیره شدن ادرار نشان‌دهنده چه نوع هایپربیلی‌روبینمی است و چه سطح بیلی‌روبین معمولاً قابل‌تشخیص بالینی می‌شود؟",
      "back": "هایپربیلی‌روبینمی غیرمستقیم (نامحلول) مثل آنمی همولیتیک یا اختلالات ژنتیکی کونژوگاسیون بیلی‌روبین (مثل سندرم ژیلبرت)؛ زردی معمولاً زمانی قابل‌تشخیص است که بیلی‌روبین سرم بالاتر از ۲.۵ میلی‌گرم بر دسی‌لیتر باشد."
    },
    {
      "id": "liverapp-fc-17",
      "front": "چه آستانه مصرف الکل در زنان و مردان با افزایش قابل‌توجه خطر بیماری کبدی الکلی همراه است؟",
      "back": "بیش از ۲ Drink در روز در زنان (حدود ۲۰ تا ۲۲ گرم) و بیش از ۳ Drink در روز در مردان (حدود ۳۳ تا ۴۵ گرم)."
    },
    {
      "id": "liverapp-fc-18",
      "front": "پرسشنامه CAGE برای چه هدفی استفاده می‌شود و چند پاسخ «بله» مطرح‌کننده مشکل مصرف الکل است؟",
      "back": "غربالگری سوءمصرف یا وابستگی به الکل؛ حتی یک پاسخ «بله» باید شک برانگیزد و بیش از یک پاسخ «بله» نشانه قوی سوءمصرف یا وابستگی است."
    },
    {
      "id": "liverapp-fc-19",
      "front": "شایع‌ترین عامل خطر تزریقی برای هپاتیت C کدام است و استفاده از خون/فرآورده‌های خونی چه اهمیتی در این زمینه دارد؟",
      "back": "مصرف مواد مخدر تزریقی؛ به دلیل غربالگری دقیق خون اهدایی امروزه، ترانسفوزیون خون دیگر عامل خطر مهم هپاتیت C حاد محسوب نمی‌شود، ولی دریافت خون پیش از سال ۱۹۹۲ برای هپاتیت C و پیش از ۱۹۸۶ برای هپاتیت B عامل خطر محسوب می‌شود."
    },
    {
      "id": "liverapp-fc-20",
      "front": "در پیشگیری از انتقال ورتیکال (مادر به فرزند) هپاتیت B، چه بار ویروسی آستانه تجویز درمان ضدویروسی در سه‌ماهه دوم یا سوم بارداری است؟",
      "back": "بیش از ۲۰۰,۰۰۰ IU/mL واحد بین‌المللی DNA ویروس هپاتیت B."
    },
    {
      "id": "liverapp-fc-21",
      "front": "کدام گروه سنی بیشترین خطر عفونت هپاتیت A را دارد و چرا؟",
      "back": "کودکان خردسال در مراکز نگهداری روزانه (مهدکودک‌ها)، به دلیل سفر به مناطق در حال توسعه یا تماس نزدیک با کودکان مبتلا."
    },
    {
      "id": "liverapp-fc-22",
      "front": "هپاتیت E عمدتاً از چه راهی منتقل می‌شود و در کدام جمعیت‌ها می‌تواند شدید یا مزمن شود؟",
      "back": "عمدتاً از طریق آب آلوده (مدفوعی-دهانی)؛ در زنان باردار می‌تواند شدید و در افراد مبتلا به نقص ایمنی (مثلاً گیرندگان پیوند عضو) می‌تواند به‌صورت مزمن بروز کند."
    },
    {
      "id": "liverapp-fc-23",
      "front": "در هموکروماتوز ارثی، کدام ژنوتیپ‌های HFE در صورت وجود اضافه‌بار غیرطبیعی آهن باید بررسی شوند؟",
      "back": "جهش‌های C282Y و H63D."
    },
    {
      "id": "liverapp-fc-24",
      "front": "یافته‌های فیزیکی تیپیک بیماری‌های کبدی کدام‌اند؟",
      "back": "زردی، هپاتومگالی، تندرنس کبدی، اسپلنومگالی، اریتم پالمار، آنژیوم عنکبوتی، و خراش‌های پوستی ناشی از خارش."
    },
    {
      "id": "liverapp-fc-25",
      "front": "نشانه‌های بیماری پیشرفته کبدی در معاینه فیزیکی شامل چه مواردی است؟",
      "back": "تحلیل عضلانی، کاهش وزن، هپاتومگالی، کبودی خودبه‌خودی، آسیت، و ادم محیطی."
    },
    {
      "id": "liverapp-fc-26",
      "front": "چرا هپاتومگالی به‌تنهایی نشانه قابل‌اعتمادی از بیماری کبدی نیست و بررسی دقیق لبه کبد چه مواردی را باید شامل شود؟",
      "back": "زیرا هپاتومگالی می‌تواند حالت طبیعی (واریانت) باشد؛ بررسی دقیق باید نامنظمی سطح، سفتی غیرطبیعی، یا وجود ندول در لبه کبد را شامل شود."
    },
    {
      "id": "liverapp-fc-27",
      "front": "قابل‌اعتمادترین یافته فیزیکی در معاینه کبد چیست و آسیت چگونه بالینی تشخیص داده می‌شود؟",
      "back": "تندرنس کبدی؛ آسیت با Shifting Dullness تشخیص داده می‌شود و در موارد مشکوک، سونوگرافی شکم بهترین روش تأیید آن است."
    },
    {
      "id": "liverapp-fc-28",
      "front": "حلقه‌های کایزر-فلشر در کدام بیماری دیده می‌شوند و چگونه بهتر مشاهده می‌شوند؟",
      "back": "در بیماری ویلسون؛ رسوب قهوه‌ای-مسی حلقه‌ای در غشای دسمه محیط قرنیه که با معاینه Slit Lamp بهتر دیده می‌شود."
    },
    {
      "id": "liverapp-fc-29",
      "front": "Dupuytren's contracture و بزرگی غده پاروتید معمولاً نشانه اختلال مصرف کدام ماده هستند؟",
      "back": "الکل."
    },
    {
      "id": "liverapp-fc-30",
      "front": "هایپرپیگمانتاسیون پوستی در کدام بیماری‌های کلستاتیک مزمن دیده می‌شود و پیگمانتاسیون slate-gray مختص کدام بیماری است؟",
      "back": "هایپرپیگمانتاسیون در PBC و PSC پیشرفته دیده می‌شود؛ پیگمانتاسیون slate-gray مختص هموکروماتوز است که با سطح طولانی‌مدت بالای آهن ایجاد می‌شود."
    },
    {
      "id": "liverapp-fc-31",
      "front": "علامت فیزیکی کلاسیک آنسفالوپاتی کبدی در معاینه دست چیست؟",
      "back": "آستریکسیس — تکان‌های تند و نامنظم دست‌ها (یا سایر اندام‌ها/زبان) در حالت کشیده‌شده."
    },
    {
      "id": "liverapp-fc-32",
      "front": "fetor hepaticus چیست و مکانیسم بروز آن کدام است؟",
      "back": "بوی خاص و اندکی آمونیاکی تنفس در بیماران مبتلا به نارسایی کبدی، به‌ویژه در صورت وجود شانت پورتوسیستمیک شدید."
    },
    {
      "id": "liverapp-fc-33",
      "front": "پیش از تأیید تشخیص آنسفالوپاتی کبدی چه علل دیگر اختلال هوشیاری باید رد شوند؟",
      "back": "اختلالات الکترولیتی، مصرف داروهای آرام‌بخش، نارسایی کلیوی، و نارسایی تنفسی."
    },
    {
      "id": "liverapp-fc-34",
      "front": "ظهور آنسفالوپاتی کبدی در جریان هپاتیت حاد چه اهمیت تشخیصی و پیش‌آگهی دارد؟",
      "back": "معیار اصلی تشخیص نارسایی حاد کبدی محسوب می‌شود و معمولاً نشانه پیش‌آگهی ضعیف است."
    },
    {
      "id": "liverapp-fc-35",
      "front": "عوامل محرک ثانویه شایع آنسفالوپاتی در بیماری مزمن کبدی کدام‌اند؟",
      "back": "خونریزی گوارشی، مصرف بیش از حد دیورتیک‌ها (overdiuresis)، اورمی، دهیدراتاسیون، اختلالات الکترولیتی، عفونت، و مصرف داروهای مخدر."
    },
    {
      "id": "liverapp-fc-36",